,Page,Formatted_content,Processed_content,keywords
213,14,We may subtract from your available balance the amount of any check or other transaction that we receive throughout the day that you or any person you authorize ,may subtract available balance amount check transaction receive throughout day person authorize,"['subtract available balance', 'balance check transaction', 'available balance check', 'day person authorize', 'balance check', 'available balance', 'subtract available', 'check transaction', 'transaction receive day', 'person authorize']"
214,14,"created or approved. We may require you or any person you authorize to provide us with identi ﬁcation, documentation or information that’s acceptable to us before ","created approved . may require person authorize provide u identi ﬁcation , documentation information ’ acceptable u","['created approved', 'created approved require', 'created', 'person authorize provide', 'authorize', 'approved require person', 'person authorize', 'approved', 'authorize provide', 'approved require']"
215,14,"allowing the transaction. If check writing is not an available feature of your account, we will not issue you checks, and you are not permitted to write checks drawn on your account. We will not pay checks if you attempt to do so. Return to Table of Contents","allowing transaction . check writing available feature account , issue check , permitted write check drawn account . pay check attempt . Return Table Contents","['check writing available', 'transaction check writing', 'allowing transaction check', 'permitted write check', 'write check', 'transaction check', 'check writing', 'allowing transaction', 'write check drawn', 'account pay check']"
216,15,Effective 10/15/20233. Transactions in a foreign currency,Effective 10/15/20233 . Transactions foreign currency,"['transactions foreign currency', '20233 transactions foreign', 'foreign currency', 'effective 10 15', '20233', '20233 transactions', 'currency', 'effective 10', 'transactions foreign', '15 20233 transactions']"
217,15,"Any transaction we conduct for you in a foreign currency, such as sending or receiving a wire transfer to or from another country, depositing a foreign check, or exchanging foreign currency in our branches, will use an exchange rate. Currency exchange is only available at a limited number of branches and in certain currencies. The foreign exchange rates we use are determined by us in our sole discretion. We may make a commission providing foreign currency exchange services to you. You ","transaction conduct foreign currency , sending receiving wire transfer another country , depositing foreign check , exchanging foreign currency branch , use exchange rate . Currency exchange available limited number branch certain currency . foreign exchange rate use determined u sole discretion . may make commission providing foreign currency exchange service .","['foreign currency branch', 'conduct foreign currency', 'foreign currency exchange', 'exchanging foreign currency', 'foreign currency sending', 'currency branch use', 'currency exchange service', 'currency exchange', 'currency foreign exchange', 'currency exchange available']"
218,15,"should expect that these foreign exchange rates will be less favorable than rates quoted online or in publications. The exchange rate we use will include a spread and may include commissions or other costs that we, our affiliates, or our vendors may charge in providing foreign currency exchange to you. The exchange rate may vary among customers depending on your relationship, products with us, or the type of transaction being conducted, the dollar amount, type of currency, and the date and time of the exchange, and whether the transaction is a debit or credit to your account. If we complete a foreign currency exchange on your behalf, such as exchanging a foreign currency incoming wire transfer into U.S. dollars, we may apply a rate we have established without prior notice to you. Additional terms speciﬁc to outgoing wire transfers or consumer international wire transfers are contained in your wire transfer agreements. We are not required to accept for deposit checks that are drawn on a non-U.S. bank or payable in a foreign currency. We may accept those checks on a collection basis ","expect foreign exchange rate le favorable rate quoted online publication . exchange rate use include spread may include commission cost , affiliate , vendor may charge providing foreign currency exchange . exchange rate may vary among customer depending relationship , product u , type transaction conducted , dollar amount , type currency , date time exchange , whether transaction debit credit account . complete foreign currency exchange behalf , exchanging foreign currency incoming wire transfer U.S. dollar , may apply rate established without prior notice . Additional term speciﬁc outgoing wire transfer consumer international wire transfer contained wire transfer agreement . required accept deposit check drawn non-U.S. bank payable foreign currency . may accept check collection basis","['expect foreign exchange', 'foreign currency exchange', 'currency exchange exchange', 'providing foreign currency', 'currency exchange', 'currency incoming wire', 'foreign currency accept', 'foreign exchange rate', 'foreign exchange', 'currency exchange behalf']"
219,15,without your speci ﬁc instruction to do so. We can reverse any amount we’ve added to your balance and send the check on a collection basis even after we’ve taken ,without speci ﬁc instruction . reverse amount ’ added balance send check collection basis even ’ taken,"['reverse added balance', 'balance send check', 'send check collection', 'ﬁc instruction reverse', 'instruction reverse added', 'balance send', 'added balance send', 'instruction reverse', 'send check', 'reverse added']"
220,15,"physical possession of the check. Our Funds Availability Policy does not apply to any foreign check, whether we accept it for deposit or on a collection basis. The actual ","physical possession check . Funds Availability Policy apply foreign check , whether accept deposit collection basis . actual","['possession check funds', 'check funds', 'check accept deposit', 'foreign check', 'deposit collection basis', 'physical possession check', 'deposit collection', 'check funds availability', 'funds availability policy', 'apply foreign check']"
221,15,"amount you receive for checks payable in a foreign currency will be determined at the exchange rate for such items that’s in effect when we’re paid for the check. If a check is returned later for any reason, we will subtract the amount of the check and any charges from other banks from your balance. We will use the applicable exchange rate in effect at the time of the return, which may be different from the exchange rate originally used for the deposit. 4. Large cash withdrawals","amount receive check payable foreign currency determined exchange rate item ’ effect ’ paid check . check returned later reason , subtract amount check charge bank balance . use applicable exchange rate effect time return , may different exchange rate originally used deposit . 4 . Large cash withdrawal","['payable foreign currency', 'exchange rate effect', 'check payable foreign', 'effect paid check', 'foreign currency determined', 'different exchange rate', 'currency determined exchange', 'determined exchange rate', 'exchange rate item', 'cash withdrawal']"
222,15,We may place reasonable restrictions on when and how you make any large cash withdrawal. We may also require that you sign a document releasing us from any liability if you are robbed or assaulted. We may refuse the withdrawal request if you do not agree with these conditions. 5. Stop payments on a check,may place reasonable restriction make large cash withdrawal . may also require sign document releasing u liability robbed assaulted . may refuse withdrawal request agree condition . 5 . Stop payment check,"['cash withdrawal require', 'stop payment check', 'assaulted refuse withdrawal', 'condition stop payment', 'withdrawal require sign', 'cash withdrawal', 'refuse withdrawal request', 'withdrawal require', 'large cash withdrawal', 'stop payment']"
223,15,"If you request us to stop payment on a check, we will charge either a Stop Payment Fee or an Online or Automated Phone Stop Payment Fee depending on","request u stop payment check , charge either Stop Payment Fee Online Automated Phone Stop Payment Fee depending","['stop payment fee', 'charge stop payment', 'stop payment check', 'stop payment', 'request stop payment', 'phone stop payment', 'check charge stop', 'payment check charge', 'charge stop', 'payment fee online']"
224,15, ,,[]
225,15,"how you request your stop payment. However, the stop payment will not be effective if we have already certi ﬁed, paid or otherwise become responsible for the  ","request stop payment . However , stop payment effective already certi ﬁed , paid otherwise become responsible","['request stop payment', 'payment stop payment', 'stop payment effective', 'stop payment', 'stop payment stop', 'payment stop', 'payment effective certi', 'certi ﬁed paid', 'ﬁed paid responsible', 'paid responsible']"
226,15,"check. For example, we can’t stop payment on a check we’ve already cashed or a deposited check where the funds have already been withdrawn. Refer to the  ","check . example , ’ stop payment check ’ already cashed deposited check fund already withdrawn . Refer","['example stop payment', 'check fund withdrawn', 'stop payment check', 'check fund', 'deposited check fund', 'payment check', 'check cashed deposited', 'stop payment', 'fund withdrawn refer', 'cashed deposited check']"
227,15,Electronic Funds Transfer Service Terms,Electronic Funds Transfer Service Terms,"['electronic funds transfer', 'funds transfer service', 'electronic funds', 'service terms', 'transfer service terms', 'funds transfer', 'transfer service', 'funds', 'terms', 'electronic']"
228,15, ,,[]
229,15,"for how to place a stop payment on recurring electronic payments. You may request a stop payment by calling us, in person, or through chase.com  or Chase Mobile. We use automated systems to identify items, so we need speci ﬁc ","place stop payment recurring electronic payment . may request stop payment calling u , person , chase.com Chase Mobile . use automated system identify item , need speci ﬁc","['chase mobile use', 'place stop payment', 'stop payment', 'stop payment calling', 'request stop payment', 'calling person chase', 'stop payment recurring', 'chase mobile', 'payment request stop', 'chase com']"
230,15,"information to process the request. In order for us to identify the item, you must give us the account number on which the check is drawn and either: • The exact check number or a range of check numbers,","information process request . order u identify item , must give u account number check drawn either : • exact check number range check number ,","['item account number', 'number check drawn', 'account number check', 'check number', 'exact check number', 'order identify item', 'account number', 'identify item account', 'check drawn', 'range check number']"
231,15,"• The payee name and the exact amount of the check, or","• payee name exact amount check ,","['payee exact check', 'payee exact', 'payee', 'exact check', 'check', 'exact']"
232,15,"• The payee name and range of amounts of the check. We are not responsible for stopping payment on checks if you do not provide this information or if you provide inconsistent information. We may refuse a payment to a payee with a similar name that we believe to be the same payee; however, we are not liable if we don’t refuse the payment. We may send you a written conﬁrmation of your stop payment. We may rely on the information in the conﬁrmation unless you notify us immediately of any errors. When the stop payment order expires, we may pay the item and have no duty to notify you. For personal accounts, your stop payment request lasts for one year even if the check is presented more than once unless you cancel your stop payment request. ","• payee name range amount check . responsible stopping payment check provide information provide inconsistent information . may refuse payment payee similar name believe payee ; however , liable ’ refuse payment . may send written conﬁrmation stop payment . may rely information conﬁrmation unless notify u immediately error . stop payment order expires , may pay item duty notify . personal account , stop payment request last one year even check presented unless cancel stop payment request .","['conﬁrmation stop payment', 'stopping payment check', 'responsible stopping payment', 'cancel stop payment', 'stopping payment', 'stop payment order', 'stop payment', 'account stop payment', 'error stop payment', 'information refuse payment']"
233,15,"However, you may place a new stop payment order, which will be effective for one calendar year from the day you place the additional order. An additional fee will be charged. For business accounts, you may place a stop payment for either: • One calendar year with automatic renewal annually for up to six additional years. We will list scheduled renewals on your business account statement 60 to ","However , may place new stop payment order , effective one calendar year day place additional order . additional fee charged . business account , may place stop payment either : • One calendar year automatic renewal annually six additional year . list scheduled renewal business account statement 60","['new stop payment', 'place stop payment', 'renewal business account', 'stop payment calendar', 'scheduled renewal business', 'stop payment order', 'scheduled renewal', 'stop payment', 'renewal business', 'renewal annually']"
234,15,"90 days in advance. The stop payment will be renewed, and you will be charged a Stop Payment Automatic Renewal Fee, unless you notify us not to renew by following the instructions in the statement, or","90 day advance . stop payment renewed , charged Stop Payment Automatic Renewal Fee , unless notify u renew following instruction statement ,","['90 day advance', 'automatic renewal fee', 'payment automatic renewal', 'renewal fee', 'renewal fee unless', 'stop payment renewed', 'payment renewed', 'automatic renewal', 'payment renewed charged', 'renewed charged stop']"
235,15,"• One calendar year (this option is not available for stop payments initiated on chase.com or Chase Mobile). Generally, we will complete your request as soon as we receive your instructions. We may allow you to place a stop payment on a cashier’s check, teller’s check or certi ﬁed check if you provide us a sworn statement—in a form we deem acceptable—","• One calendar year ( option available stop payment initiated chase.com Chase Mobile ) . Generally , complete request soon receive instruction . may allow place stop payment cashier ’ check , teller ’ check certi ﬁed check provide u sworn statement—in form deem acceptable—","['place stop payment', 'available stop payment', 'payment initiated chase', 'stop payment cashier', 'stop payment', 'stop payment initiated', 'initiated chase com', 'chase mobile', 'chase mobile generally', 'com chase mobile']"
236,15,"that the check is lost, stolen or destroyed. Even if we agree to attempt to stop payment on a cashier’s check, teller’s check (official check) or certi ﬁed check, if the check is ","check lost , stolen destroyed . Even agree attempt stop payment cashier ’ check , teller ’ check ( official check ) certi ﬁed check , check","['check teller check', 'check lost stolen', 'teller check official', 'cashier check', 'teller check', 'payment cashier check', 'cashier check teller', 'check teller', 'stop payment cashier', 'certi ﬁed check']"
237,15,"presented for payment, we may pay it and you will be liable to us for that item, unless otherwise required by applicable law. After you place a stop payment, we are not required to refund the check amount or issue a replacement check until at least 90 days after the original check’s issue date. We are not required to refund the check amount or issue a replacement check if the check is presented for payment within 90 days after the issue date. 6. Account numbers on funds transfers","presented payment , may pay liable u item , unless otherwise required applicable law . place stop payment , required refund check amount issue replacement check least 90 day original check ’ issue date . required refund check amount issue replacement check check presented payment within 90 day issue date . 6 . Account number fund transfer","['payment required refund', 'required refund check', 'fund transfer', 'refund check', 'required refund', 'payment pay liable', 'payment 90 day', 'replacement check', 'number fund transfer', 'check 90 day']"
238,15,"If you instruct us to send a funds transfer, such as a wire or ACH, we and every other bank involved in the transfer may rely on any bank number or account number you ","instruct u send fund transfer , wire ACH , every bank involved transfer may rely bank number account number","['send fund transfer', 'transfer rely bank', 'fund transfer', 'bank involved transfer', 'instruct send fund', 'send fund', 'fund transfer wire', 'wire ach bank', 'ach bank involved', 'bank involved']"
239,15,"provide. If the funds transfer instruction gives both a bank number or account number and a name, and the name identi ﬁes a different person from the bank or account ","provide . fund transfer instruction give bank number account number name , name identi ﬁes different person bank account","['provide fund transfer', 'fund transfer instruction', 'fund transfer', 'person bank account', 'provide fund', 'transfer instruction bank', 'different person bank', 'bank number account', 'transfer instruction', 'instruction bank number']"
240,15,"owner identi ﬁed by number, we and other banks that handle the funds transfer may still rely exclusively on the number. We have no duty to detect any inconsistency ","owner identi ﬁed number , bank handle fund transfer may still rely exclusively number . duty detect inconsistency","['number bank handle', 'identi ﬁed number', 'handle fund transfer', 'fund transfer rely', 'ﬁed number bank', 'owner identi ﬁed', 'number duty detect', 'number bank', 'owner identi', 'bank handle fund']"
241,15,between the bank number or account number and the name. 7. Savings account withdrawals,bank number account number name . 7 . Savings account withdrawal,"['savings account withdrawal', 'bank number account', 'number savings account', 'account withdrawal', 'account number savings', 'bank number', 'number account number', 'savings account', 'number account', 'account number']"
242,15,"In this agreement, a savings account means an account, including a money market account (and excluding NOW accounts), for which we reserve the right to require seven days’ prior written notice to withdrawal. See the section Our right to require advance notice of withdrawals . During any monthly statement period, you may make ","agreement , saving account mean account , including money market account ( excluding account ) , reserve right require seven day ’ prior written notice withdrawal . See section right require advance notice withdrawal . monthly statement period , may make","['agreement saving account', 'account reserve', 'advance notice withdrawal', 'account reserve right', 'notice withdrawal section', 'notice withdrawal monthly', 'money market account', 'notice withdrawal', 'saving account mean', 'saving account']"
243,15,"transfers and withdrawals, regardless of the number of transfers and withdrawals or the way in which transfers and withdrawals are made. You agree not to make withdrawals by negotiable or transferable instruments (checks or drafts) for the purpose of making transfers to third parties from savings accounts. Return to Table of Contents","transfer withdrawal , regardless number transfer withdrawal way transfer withdrawal made . agree make withdrawal negotiable transferable instrument ( check draft ) purpose making transfer third party saving account . Return Table Contents","['transfer withdrawal way', 'withdrawal negotiable transferable', 'withdrawal way transfer', 'transfer withdrawal', 'transfer withdrawal regardless', 'transfer withdrawal agree', 'number transfer withdrawal', 'way transfer withdrawal', 'purpose making transfer', 'making transfer']"
244,16,Effective 10/15/20238. Our right to require advance notice of withdrawals,Effective 10/15/20238 . right require advance notice withdrawal,"['advance notice withdrawal', 'notice withdrawal', 'require advance notice', 'advance notice', 'effective 10 15', 'right require advance', '20238 right require', '20238', 'withdrawal', 'require advance']"
245,16,"For all savings accounts and all personal interest-bearing checking accounts, we reserve the right to require seven days’ prior written notice of withdrawal. 9. Check cashing","saving account personal interest-bearing checking account , reserve right require seven day ’ prior written notice withdrawal . 9 . Check cashing","['checking account reserve', 'notice withdrawal check', 'withdrawal check cashing', 'bearing checking account', 'account reserve', 'account reserve right', 'checking account', 'check cashing', 'withdrawal check', 'notice withdrawal']"
246,16,"If a person who is not our deposit or loan customer tries to cash your check at any of our branches, we may charge them a fee or refuse to cash it. We may also require ","person deposit loan customer try cash check branch , may charge fee refuse cash . may also require","['try cash check', 'person deposit loan', 'cash check branch', 'deposit loan', 'customer try cash', 'deposit loan customer', 'cash require', 'fee refuse cash', 'refuse cash require', 'loan customer try']"
247,16,"that they provide us identi ﬁcation we deem acceptable. 10. Incomplete, future-dated, conditional or stale-dated checksYou agree not to write a check that’s incomplete, future-dated or tries to limit the time or method of payment with a condition, such as “Void after 180 days” or “Valid only for $1,000 or less.” We have no duty to discover, observe or comply with these conditions and may pay such checks. If we pay a conditional check, the conditions do not apply to us. We may choose to pay or not to pay a stale-dated check (dated more than six months before it is presented), regardless of how old it is. If we pay it, you will be ","provide u identi ﬁcation deem acceptable . 10 . Incomplete , future-dated , conditional stale-dated checksYou agree write check ’ incomplete , future-dated try limit time method payment condition , “ Void 180 day ” “ Valid $ 1,000 less. ” duty discover , observe comply condition may pay check . pay conditional check , condition apply u . may choose pay pay stale-dated check ( dated six month presented ) , regardless old . pay ,","['stale dated check', 'dated check', 'stale dated checksyou', 'dated checksyou agree', 'pay stale dated', 'dated check dated', 'condition pay check', 'dated checksyou', 'write check', 'check dated']"
248,16,responsible for the check. 11. Multiple signatures,responsible check . 11 . Multiple signature,"['multiple signature', '11 multiple signature', 'responsible check', 'signature', 'responsible check 11', 'check 11 multiple', 'responsible', 'check', 'check 11', 'multiple']"
249,16,"We are not required to comply with any multiple-signature requirement, either on personal or business accounts, even if your signature card speci ﬁes that multiple ","required comply multiple-signature requirement , either personal business account , even signature card speci ﬁes multiple","['multiple signature requirement', 'comply multiple signature', 'signature requirement personal', 'signature requirement', 'multiple signature', 'business account signature', 'required comply multiple', 'account signature card', 'account signature', 'comply multiple']"
250,16,signatures are required or you have otherwise instructed us to do so. A multiple-signature requirement is for your internal control purposes only.12. Facsimile signatures,signature required otherwise instructed u . multiple-signature requirement internal control purpose only.12 . Facsimile signature,"['signature required instructed', 'signature requirement', 'signature requirement internal', 'multiple signature requirement', 'signature required', '12 facsimile signature', 'instructed multiple signature', 'facsimile signature', 'multiple signature', 'signature']"
251,16,"We may pay a check bearing any form of facsimile or computer-generated signature. If you use a facsimile or computer-generated signature, or provide a signature card authorizing any such signature, you will be solely responsible for any check bearing a similar signature, regardless of your negligence or whether the signature was the same one you previously used. 13. Review of checks and signatures","may pay check bearing form facsimile computer-generated signature . use facsimile computer-generated signature , provide signature card authorizing signature , solely responsible check bearing similar signature , regardless negligence whether signature one previously used . 13. Review check signature","['provide signature card', 'signature card authorizing', 'card authorizing signature', 'provide signature', 'review check signature', 'signature use facsimile', 'authorizing signature', 'check signature', 'computer generated signature', 'signature use']"
