,Page,Formatted_content,Processed_content,keywords
115,9,"We pay overdrafts at our discretion, which means we do not guarantee that we will always authorize or pay any type of transaction. Even if we’ve paid overdraft transactions before, we are not required to do it in the future. We may pay or return any transaction when it is presented if your account balance is less than the amount of that transaction. The account balance we use to pay or ","pay overdraft discretion , mean guarantee always authorize pay type transaction . Even ’ paid overdraft transaction , required future . may pay return transaction presented account balance le amount transaction . account balance use pay","['pay overdraft discretion', 'overdraft discretion mean', 'overdraft transaction required', 'overdraft transaction', 'pay overdraft', 'paid overdraft transaction', 'transaction paid overdraft', 'overdraft discretion', 'paid overdraft', 'overdraft']"
116,9,"return a transaction is determined during our nightly processing. During our nightly processing, we take your previous end of day’s balance and post credits. If there are any deposits not yet available for use or holds (such as a garnishment), these will reduce the account balance used to pay your transactions. Then we subtract any debit transactions presented during our nightly processing. We look at your balance only once when the transaction is presented (or presented again at a later time such as a check or ACH) to us to decide if you have enough funds to pay the transaction. For details, refer to the section Posting Order . The available balance shown to you during the day may not be the same amount used to pay your transactions as some transactions may not be displayed to you before nightly processing. We will decline any requested ATM withdrawal unless your available balance at the time is equal to or more than the amount of the requested withdrawal. Special rules for everyday debit card transactions, overdraft and fees for these transactions, are described in the Electronic Funds Transfer Service Terms. ","return transaction determined nightly processing . nightly processing , take previous end day ’ balance post credit . deposit yet available use hold ( garnishment ) , reduce account balance used pay transaction . subtract debit transaction presented nightly processing . look balance transaction presented ( presented later time check ACH ) u decide enough fund pay transaction . detail , refer section Posting Order . available balance shown day may amount used pay transaction transaction may displayed nightly processing . decline requested ATM withdrawal unless available balance time equal amount requested withdrawal . Special rule everyday debit card transaction , overdraft fee transaction , described Electronic Funds Transfer Service Terms .","['rule everyday debit', 'debit transaction', 'everyday debit', 'fund pay transaction', 'atm withdrawal', 'overdraft fee transaction', 'debit transaction presented', 'transaction determined nightly', 'debit card transaction', 'transaction presented nightly']"
117,9,Withdrawals and debits at ATMs or with merchants may be subject to additional limitation described in the Additional Banking Services and Fees. 2. Your responsibility to repay overdrafts,Withdrawals debit ATMs merchant may subject additional limitation described Additional Banking Services Fees . 2 . responsibility repay overdraft,"['withdrawals debit atms', 'debit atms merchant', 'debit atms', 'withdrawals debit', 'atms merchant subject', 'responsibility repay overdraft', 'atms merchant', 'overdraft', 'repay overdraft', 'described additional banking']"
118,9,"You must immediately pay the amount of any overdraft along with any fees that apply. We may report you to consumer reporting agencies, close your account, or both. This could affect your ability to open accounts with us or other banks in the future. For certain business accounts, if you don’t immediately pay the amount of overdraft, you may also be charged additional fees or interest during nightly processing. Return to Table of Contents","must immediately pay amount overdraft along fee apply . may report consumer reporting agency , close account , . could affect ability open account u bank future . certain business account , ’ immediately pay amount overdraft , may also charged additional fee interest nightly processing . Return Table Contents","['overdraft fee apply', 'pay overdraft fee', 'immediately pay overdraft', 'pay overdraft charged', 'overdraft charged additional', 'overdraft fee', 'pay overdraft', 'overdraft charged', 'account immediately pay', 'overdraft']"
119,10,Effective 10/15/2023You authorize us to use the money from any subsequent deposits to your account (including but not limited to a direct deposit of Social Security or any other state or ,Effective 10/15/2023You authorize u use money subsequent deposit account ( including limited direct deposit Social Security state,"['subsequent deposit account', 'deposit social', 'direct deposit social', 'deposit social security', 'deposit account', 'limited direct deposit', '2023you authorize use', 'deposit account including', 'direct deposit', 'money subsequent deposit']"
120,10,federal bene ﬁt payment) to pay any overdraft and resulting fees in that account. The repayment of any overdraft or resulting fee from any other account is outlined ,federal bene ﬁt payment ) pay overdraft resulting fee account . repayment overdraft resulting fee account outlined,"['repayment overdraft', 'repayment overdraft resulting', 'payment pay overdraft', 'account repayment overdraft', 'fee account repayment', 'pay overdraft resulting', 'pay overdraft', 'overdraft resulting fee', 'bene ﬁt payment', 'federal bene ﬁt']"
121,10,"in the section Setoff and Security Interest . For deposits you have authorized, you understand and agree that if you don’t want your bene ﬁts applied in this way, you may ","section Setoff Security Interest . deposit authorized , understand agree ’ want bene ﬁts applied way , may","['security deposit authorized', 'setoff security deposit', 'security deposit', 'deposit authorized understand', 'deposit authorized', 'deposit', 'section setoff security', 'section setoff', 'authorized understand agree', 'authorized understand']"
122,10,change your direct deposit instructions at any time with the person or organization paying the bene ﬁts. You agree to pay all costs and expenses we incur in collecting any overdraft. We may still pursue collection of the amount you owe (including suing you) after it is ,change direct deposit instruction time person organization paying bene ﬁts . agree pay cost expense incur collecting overdraft . may still pursue collection amount owe ( including suing ),"['change direct deposit', 'direct deposit instruction', 'collecting overdraft pursue', 'overdraft pursue collection', 'incur collecting overdraft', 'direct deposit', 'overdraft pursue', 'collecting overdraft', 'deposit instruction', 'deposit instruction time']"
123,10,charged off. It’s your responsibility to avoid overdrawing your account. 3. Overdraft Fees,charged . ’ responsibility avoid overdrawing account . 3 . Overdraft Fees,"['account overdraft fees', 'overdraft fees', 'overdrawing account', 'overdrawing account overdraft', 'account overdraft', 'avoid overdrawing account', 'overdraft', 'responsibility avoid overdrawing', 'avoid overdrawing', 'charged responsibility avoid']"
124,10,"We will charge an Overdraft Fee (may also be referred to as Insufficient Funds Fee) during nightly processing for any paid transaction posted on a business day when your account is overdrawn. If we return a transaction, we will not charge a fee. We will charge an Overdraft Fee for a transaction that may have been previously returned unpaid if it is later paid against an overdrawn balance. Special rules for everyday debit card transactions are described in the Electronic Funds Transfer Service Terms. Refer to your product information and Fee Schedule for information about what fees apply and how fees are calculated for your account. We may limit the number of Overdraft Fees we charge for a business day. For business accounts, we may charge interest on any amount you are overdrawn that you haven’t repaid promptly. 4. Overdraft Protection","charge Overdraft Fee ( may also referred Insufficient Funds Fee ) nightly processing paid transaction posted business day account overdrawn . return transaction , charge fee . charge Overdraft Fee transaction may previously returned unpaid later paid overdrawn balance . Special rule everyday debit card transaction described Electronic Funds Transfer Service Terms . Refer product information Fee Schedule information fee apply fee calculated account . may limit number Overdraft Fees charge business day . business account , may charge interest amount overdrawn ’ repaid promptly . 4 . Overdraft Protection","['overdraft fee transaction', 'charge overdraft fee', 'overdraft fees charge', 'fee charge overdraft', 'overdraft fees', 'overdraft fee', 'charge overdraft', 'overdraft fee referred', 'account charge overdrawn', 'number overdraft fees']"
125,10,"Overdraft Protection allows you to link one of your accounts as your backup account to your checking account to help pay an overdraft. If your checking account does not have enough money, we will use the available funds from your backup account to authorize or pay transactions. Establishing or Canceling Overdraft Protection: Any owner of both a qualifying checking account and the backup account may enroll in Overdraft Protection ","Overdraft Protection allows link one account backup account checking account help pay overdraft . checking account enough money , use available fund backup account authorize pay transaction . Establishing Canceling Overdraft Protection : owner qualifying checking account backup account may enroll Overdraft Protection","['overdraft protection', 'overdraft protection allows', 'enroll overdraft protection', 'canceling overdraft protection', 'overdraft protection owner', 'pay overdraft', 'overdraft checking account', 'establishing canceling overdraft', 'canceling overdraft', 'pay overdraft checking']"
126,10,"without the consent of other owners and both accounts must share at least one owner to maintain Overdraft Protection. Any owner of the checking account or the backup account may cancel Overdraft Protection (by terminating the service or closing the account) without the consent of other owners. A backup account can provide Overdraft Protection for more than one checking account, but a checking account can have only one backup account. A personal checking account may be linked to a Chase personal savings account; and a business checking account may be linked to a Chase business savings account or a business line of credit in good standing. We may cancel your Overdraft Protection service at any time. Your request to add or cancel Overdraft Protection will become effective within a reasonable time after approval. Transfers:  We will make one Overdraft Protection transfer per business day that will appear on your statement for both accounts. If you have enough available funds ","without consent owner account must share least one owner maintain Overdraft Protection . owner checking account backup account may cancel Overdraft Protection ( terminating service closing account ) without consent owner . backup account provide Overdraft Protection one checking account , checking account one backup account . personal checking account may linked Chase personal saving account ; business checking account may linked Chase business saving account business line credit good standing . may cancel Overdraft Protection service time . request add cancel Overdraft Protection become effective within reasonable time approval . Transfers : make one Overdraft Protection transfer per business day appear statement account . enough available fund","['overdraft protection transfer', 'provide overdraft protection', 'overdraft protection service', 'overdraft protection', 'maintain overdraft protection', 'make overdraft protection', 'cancel overdraft protection', 'overdraft protection terminating', 'account provide overdraft', 'overdraft protection owner']"
127,10,"in your backup account, we will automatically transfer enough to bring your checking account balance to zero. If you do not have enough available funds in your backup ","backup account , automatically transfer enough bring checking account balance zero . enough available fund backup","['backup account automatically', 'fund backup', 'available fund backup', 'backup account', 'account automatically transfer', 'checking account balance', 'checking account', 'automatically transfer', 'bring checking account', 'transfer bring checking']"
128,10,"account to bring your checking account balance to zero, but you have enough available funds to pay one or more transactions and/or your previous day’s negative balance, we will transfer that amount. If the amount transferred does not bring your checking account balance to zero, your checking account will become overdrawn and you may be charged Overdraft Fees. If we authorize your transaction, we will leave the funds in your backup account until we pay the transaction, which may take several days. However, if you use those funds before the transaction is paid there will not be available funds to transfer and your checking account may become overdrawn and charged an Overdraft Fee. The available balance for a savings account is determined at the time that we authorize a transaction or at the end of business day processing. The available balance for a business line of credit is determined at the end of the previous business day processing. We are not required to notify you if funds from the backup account cannot be transferred for Overdraft Protection (for example if the account is dormant, purged, restricted or not in good standing). Refer to the section Restricting Your Account; Blocking or Delaying Transactions  for additional information. D. Electronic Funds Transfer Service Terms; Payments, Deposits and Transfers You Make or Receive by Electronic Methods","account bring checking account balance zero , enough available fund pay one transaction and/or previous day ’ negative balance , transfer amount . amount transferred bring checking account balance zero , checking account become overdrawn may charged Overdraft Fees . authorize transaction , leave fund backup account pay transaction , may take several day . However , use fund transaction paid available fund transfer checking account may become overdrawn charged Overdraft Fee . available balance saving account determined time authorize transaction end business day processing . available balance business line credit determined end previous business day processing . required notify fund backup account transferred Overdraft Protection ( example account dormant , purged , restricted good standing ) . Refer section Restricting Account ; Blocking Delaying Transactions additional information . D. Electronic Funds Transfer Service Terms ; Payments , Deposits Transfers Make Receive Electronic Methods","['transferred overdraft protection', 'overdraft protection example', 'overdraft protection', 'account transferred overdraft', 'overdraft fees authorize', 'transferred overdraft', 'checking account overdrawn', 'overdraft fee available', 'available fund transfer', 'transfer checking account']"
129,10,"We provide a variety of electronic funds transfer (EFT) services for deposit accounts. These include payments, deposits and transfers that you make or receive by ","provide variety electronic fund transfer ( EFT ) service deposit account . include payment , deposit transfer make receive","['eft service deposit', 'eft service', 'electronic fund transfer', 'fund transfer eft', 'electronic fund', 'transfer eft service', 'transfer eft', 'service deposit account', 'eft', 'deposit transfer']"
130,10,"electronic methods, such as with your card, telephone, or chase.com. 1. Types of EFT servicesa. Debit and ATM cards","electronic method , card , telephone , chase.com . 1 . Types EFT servicesa . Debit ATM card","['eft servicesa debit', 'card telephone chase', 'debit atm card', 'types eft servicesa', 'electronic method card', 'telephone chase com', 'servicesa debit atm', 'atm card', 'debit atm', 'method card telephone']"
131,10,"As a condition of opening certain accounts, you agree that we may automatically issue you a Chase debit or ATM card. However, activating your card is not required to keep your account open. We may reissue you a new card automatically before your current card expires; we will deactivate your old card when you activate your ","condition opening certain account , agree may automatically issue Chase debit ATM card . However , activating card required keep account open . may reissue new card automatically current card expires ; deactivate old card activate","['chase debit atm', 'atm card activating', 'automatically issue chase', 'issue chase debit', 'debit atm card', 'chase debit', 'card activating card', 'activating card required', 'atm card', 'card activating']"
132,10,replacement card. Your Personal Identi ﬁcation Number (PIN) will remain the same. You can use your card as follows: At ATMs to: • Withdraw cash;,replacement card . Personal Identi ﬁcation Number ( PIN ) remain . use card follows : ATMs : • Withdraw cash ;,"['replacement card personal', 'replacement card', 'ﬁcation number pin', 'card personal identi', 'remain use card', 'number pin remain', 'card follows atms', 'number pin', 'use card', 'atms withdraw cash']"
133,10,• Transfer money;,• Transfer money ;,"['transfer money', 'transfer', 'money']"
134,10,• Check your balances;,• Check balance ;,"['check balance', 'balance', 'check']"
135,10,• Deposit cash or checks;*,• Deposit cash check ; *,"['deposit cash check', 'deposit cash', 'cash check', 'deposit', 'cash', 'check']"
136,10,• Make payments to qualifying Chase credit cards and loans;*,• Make payment qualifying Chase credit card loan ; *,"['payment qualifying chase', 'qualifying chase credit', 'chase credit', 'chase credit card', 'make payment qualifying', 'card loan', 'credit card loan', 'payment qualifying', 'make payment', 'loan']"
137,10,• Obtain a copy of recent account activity.*,• Obtain copy recent account activity . *,"['copy recent account', 'recent account activity', 'copy recent', 'obtain copy recent', 'recent account', 'account activity', 'obtain copy', 'copy', 'account', 'recent']"
138,10,"Services marked with an asterisk (*) are available only at Chase ATMs, and all services may not be available at all Chase ATMs.When you use a Chase ATM, you will have access to all of your personal checking, savings and credit card accounts, regardless of whether the accounts are linked to ","Services marked asterisk ( * ) available Chase ATMs , service may available Chase ATMs.When use Chase ATM , access personal checking , saving credit card account , regardless whether account linked","['chase atm access', 'chase atms service', 'chase atms use', 'asterisk available chase', 'atms use chase', 'use chase atm', 'available chase atms', 'chase atms', 'service available chase', 'chase atm']"
139,10,"your card. When linking multiple accounts to your card, one checking account and one savings account will be designated as primary. We also offer cards with limited functions for your deposit accounts, such as deposit-only business cards that can be linked to a checking or savings account. Subject to the limited functions provided for each card, limited-function cards are also considered “cards” under this agreement. You can use a non-Chase ATM only if it is in a participating network. Your primary checking and savings accounts will be accessible on that network, and your other ","card . linking multiple account card , one checking account one saving account designated primary . also offer card limited function deposit account , deposit-only business card linked checking saving account . Subject limited function provided card , limited-function card also considered “ card ” agreement . use non-Chase ATM participating network . primary checking saving account accessible network ,","['chase atm participating', 'non chase atm', 'chase atm', 'multiple account card', 'card checking account', 'account card', 'atm participating network', 'deposit business card', 'card limited function', 'provided card limited']"
140,10,"linked accounts may be accessible. Outside the U.S., only your primary checking account is usually accessible. We may charge a Non-Chase ATM Fee, and the ATM owner/network may also charge a fee. Any of these fees may be charged for any activity, including withdrawals, balance inquiries and transfers. We generally waive the","linked account may accessible . Outside U.S. , primary checking account usually accessible . may charge Non-Chase ATM Fee , ATM owner/network may also charge fee . fee may charged activity , including withdrawal , balance inquiry transfer . generally waive","['chase atm fee', 'non chase atm', 'chase atm', 'atm fee', 'atm fee atm', 'fee atm owner', 'linked account accessible', 'fee atm', 'atm owner', 'primary checking account']"
141,10,Return to Table of Contents,Return Table Contents,"['return table contents', 'return table', 'table contents', 'table', 'return', 'contents']"
142,11,Effective 10/15/2023Non-Chase ATM Fee for a balance inquiry or transfer if it is made in connection with a withdrawal at the same non-Chase ATM at the same time with the same card. ,Effective 10/15/2023Non-Chase ATM Fee balance inquiry transfer made connection withdrawal non-Chase ATM time card .,"['chase atm fee', 'chase atm time', 'chase atm', 'atm fee balance', 'non chase atm', '2023non chase atm', 'atm fee', 'withdrawal non chase', 'fee balance inquiry', 'atm time card']"
143,11,"On some accounts, we will refund ATM fees charged by the ATM owner/network; however, some ATM owners/networks do not identify these fees in the information they send to us and, as a result, we may not automatically refund the fee. If for any reason the refund is not processed, please contact us. If you choose to convert an international transaction to U.S. dollars at either an ATM or on a purchase, foreign currency commissions and fees included in the exchange rate charged by third parties are excluded from Chase reimbursements. You can use your debit card (but not your ATM card):At participating merchants to: • Purchase goods and services. Purchases are subtracted from your primary checking account. If you have arranged with your merchant to make recurring ","account , refund ATM fee charged ATM owner/network ; however , ATM owners/networks identify fee information send u , result , may automatically refund fee . reason refund processed , please contact u . choose convert international transaction U.S. dollar either ATM purchase , foreign currency commission fee included exchange rate charged third party excluded Chase reimbursement . use debit card ( ATM card ) : participating merchant : • Purchase good service . Purchases subtracted primary checking account . arranged merchant make recurring","['atm purchase foreign', 'refund atm fee', 'atm fee charged', 'fee charged atm', 'transaction dollar atm', 'atm fee', 'exchange rate charged', 'dollar atm purchase', 'international transaction dollar', 'debit card atm']"
144,11,"payments, you must notify the merchant if your card number or expiration date has changed or your debit card is closed. We may also provide the merchant or the participating network your new account number and expiration date. • Withdraw cash while making a purchase using your PIN if the merchant permits the cash-back option. • Send or receive payments from another person, or receive payments from a business by providing your card number to third-party payment services. At participating financial institutions to: • Withdraw funds at a teller. Withdrawals are subtracted from your primary checking account. You will be charged a Non-ATM Cash Fee. b. Electronic transfers using your account numberYou may authorize a third party to transfer funds to or from your account by providing your account number and your routing number or your debit card number. These transfers may use various payment networks and may take various forms, such as: • Employer payroll, government bene ﬁts or other direct deposits;","payment , must notify merchant card number expiration date changed debit card closed . may also provide merchant participating network new account number expiration date . • Withdraw cash making purchase using PIN merchant permit cash-back option . • Send receive payment another person , receive payment business providing card number third-party payment service . participating financial institution : • Withdraw fund teller . Withdrawals subtracted primary checking account . charged Non-ATM Cash Fee . b . Electronic transfer using account numberYou may authorize third party transfer fund account providing account number routing number debit card number . transfer may use various payment network may take various form , : • Employer payroll , government bene ﬁts direct deposit ;","['use various payment', 'payment service', 'payment network various', 'electronic transfer using', 'payment service participating', 'various payment network', 'fee electronic transfer', 'debit card', 'cash fee electronic', 'payment network']"
