,Page,Formatted_content,Processed_content,keywords
0,5,Effective 10/15/2023Deposit Account Agreement,Effective 10/15/2023Deposit Account Agreement,"['2023deposit account agreement', 'account agreement', '2023deposit account', 'effective 10 15', '15 2023deposit account', 'account', 'effective 10', '15 2023deposit', '2023deposit', '10 15 2023deposit']"
1,5,"This agreement is the contract that governs your account. Whether you have a personal or business deposit account, this document is the basic agreement between you and us (JPMorgan Chase Bank, N.A. or “Chase”). By ","agreement contract governs account . Whether personal business deposit account , document basic agreement u ( JPMorgan Chase Bank , N.A . “ Chase ” ) .","['agreement jpmorgan chase', 'basic agreement jpmorgan', 'agreement jpmorgan', 'contract governs account', 'deposit account document', 'agreement contract governs', 'document basic agreement', 'account document', 'agreement contract', 'jpmorgan chase bank']"
2,5,"signing a signature card or submitting an account application, or by using any of our deposit account services, you and anyone else identiﬁed as an owner of the account agree to the terms in this agreement. Customers of some of our business groups, such as Corporate Banking, will get a different agreement and their accounts will be governed by that agreement, not this one. If you have a product that is not a deposit account, such as a credit card, this agreement does not apply to that product. Also, other products or services, such as online banking or retirement accounts, may have additional agreements. In the event of an irreconcilable conflict between the terms of this agreement and any applicable Chase agreements, the terms of this agreement will control, unless otherwise explicitly stated. This agreement also refers to and includes other disclosures we may provide to you, including (1) product information, (2) rate information, (3) banking services and ","signing signature card submitting account application , using deposit account service , anyone else identiﬁed owner account agree term agreement . Customers business group , Corporate Banking , get different agreement account governed agreement , one . product deposit account , credit card , agreement apply product . Also , product service , online banking retirement account , may additional agreement . event irreconcilable conflict term agreement applicable Chase agreement , term agreement control , unless otherwise explicitly stated . agreement also refers includes disclosure may provide , including ( 1 ) product information , ( 2 ) rate information , ( 3 ) banking service","['agreement applicable chase', 'chase agreement', 'applicable chase agreement', 'card agreement', 'banking different agreement', 'chase agreement term', 'term agreement customers', 'card agreement apply', 'agreement account', 'credit card agreement']"
3,5,"fees, and (4) other disclosures, agreements, and amendments that we may provide to you. All may contain information on fees that apply to your accounts. Products and services as well as associated fees, charges, interest rates and balance requirements may differ among different geographic locations. Not all products and services, including check cashing, are offered at all locations. I. Definitions","fee , ( 4 ) disclosure , agreement , amendment may provide . may contain information fee apply account . Products service well associated fee , charge , interest rate balance requirement may differ among different geographic location . product service , including check cashing , offered location . I. Definitions","['fee apply account', 'fee disclosure agreement', 'service associated fee', 'fee disclosure', 'contain information fee', 'product service including', 'information fee apply', 'associated fee charge', 'fee charge', 'account products service']"
4,5,"Here are some important terms that we use throughout this agreement: Account: Any deposit account, such as a checking or savings account, you have with us that is covered by this agreement.ACH (Automated Clearing House): ACH, which may also be referred to as automatic payments, are funds transferred to or from your account through an ","important term use throughout agreement : Account : deposit account , checking saving account , u covered agreement.ACH ( Automated Clearing House ) : ACH , may also referred automatic payment , fund transferred account","['account covered agreement', 'agreement account deposit', 'agreement account', 'account deposit account', 'covered agreement ach', 'use agreement account', 'saving account covered', 'deposit account', 'account deposit', 'agreement ach automated']"
5,5,"automated clearing house network. Common examples include direct deposits of payroll, tax refunds, government bene ﬁts, and pensions. ATM (Automated Teller Machine): An electronic device that performs many banking services, which can include withdrawals and balance inquiries. Available balance:  The amount of money in your account that you can use right now. You can ﬁnd this balance on receipts you receive at ATMs, from a banker at a ","automated clearing house network . Common example include direct deposit payroll , tax refund , government bene ﬁts , pension . ATM ( Automated Teller Machine ) : electronic device performs many banking service , include withdrawal balance inquiry . Available balance : amount money account use right . ﬁnd balance receipt receive ATMs , banker","['automated teller machine', 'receive atms', 'atm automated', 'automated teller', 'atms', 'atm automated teller', 'device performs banking', 'performs banking service', 'receive atms banker', 'atms banker']"
6,5,"branch, on chase.com or Chase Mobile. Here’s how we calculate your available balance: We start with your previous end of day balance,","branch , chase.com Chase Mobile . ’ calculate available balance : start previous end day balance ,","['chase mobile calculate', 'calculate available balance', 'branch chase com', 'available balance', 'com chase mobile', 'available balance start', 'chase mobile', 'end day balance', 'branch chase', 'mobile calculate available']"
7,5,"• Add any pending credit transactions,","• Add pending credit transaction ,","['add pending credit', 'pending credit transaction', 'pending credit', 'credit transaction', 'add pending', 'transaction', 'credit', 'pending', 'add']"
8,5,"• Subtract any pending debit transactions, deposits that are not available yet for withdrawal, and any holds on your account. Business day: Every day except Saturdays, Sundays and federal holidays. Some branches may close on a business day due to an emergency or to observe a state ","• Subtract pending debit transaction , deposit available yet withdrawal , hold account . Business day : Every day except Saturdays , Sundays federal holiday . branch may close business day due emergency observe state","['account business day', 'subtract pending debit', 'business day day', 'close business day', 'business day', 'business day emergency', 'federal holiday branch', 'saturdays sundays federal', 'federal holiday', 'debit transaction']"
9,5,"holiday. Check:  A written order to pay a speci ﬁc amount of money drawn on, payable through, payable at or processed by a bank or other depository institution. If a check is ","holiday . Check : written order pay speci ﬁc amount money drawn , payable , payable processed bank depository institution . check","['holiday check written', 'holiday check', 'payable processed bank', 'written order pay', 'depository institution check', 'payable payable processed', 'order pay speci', 'processed bank', 'processed bank depository', 'money drawn payable']"
10,5,"sent or returned as an electronic image or as a substitute check, it is still considered a check.Debit card transaction:  Any purchase or bill payment using your debit card. A debit card transaction may be either an everyday (not recurring) purchase ","sent returned electronic image substitute check , still considered check.Debit card transaction : purchase bill payment using debit card . debit card transaction may either everyday ( recurring ) purchase","['debit card transaction', 'considered check debit', 'card debit', 'debit card debit', 'card debit card', 'debit card', 'check debit card', 'check debit', 'card transaction', 'using debit']"
11,5,"transaction or a recurring payment, such as a monthly bill.Direct deposit:  An automatic electronic deposit made through the ACH network to your account by someone else, such as an employer issuing payroll or a ","transaction recurring payment , monthly bill.Direct deposit : automatic electronic deposit made ACH network account someone else , employer issuing payroll","['electronic deposit ach', 'transaction recurring payment', 'automatic electronic deposit', 'electronic deposit', 'direct deposit automatic', 'deposit automatic electronic', 'recurring payment', 'deposit ach network', 'transaction recurring', 'direct deposit']"
12,5,"government paying bene ﬁts. Transaction (may also be referred to as item): Any check, ACH, funds transfer, online banking transaction, wire transfer, teller cash withdrawal, ATM withdrawal, ","government paying bene ﬁts . Transaction ( may also referred item ) : check , ACH , fund transfer , online banking transaction , wire transfer , teller cash withdrawal , ATM withdrawal ,","['government paying bene', 'paying bene ﬁts', 'paying bene', 'bene ﬁts transaction', 'government paying', 'banking transaction', 'wire transfer', 'fund transfer', 'cash withdrawal', 'banking']"
13,5,"debit card purchase, fee, charge or other instruction for an amount to be added to or subtracted from your balance, whether or not we pay or settle the transaction. Overdraft: The amount by which any transaction(s) would exceed the balance in your account either when it is authorized or presented for settlement during our ","debit card purchase , fee , charge instruction amount added subtracted balance , whether pay settle transaction . Overdraft : amount transaction ( ) would exceed balance account either authorized presented settlement","['transaction overdraft transaction', 'transaction overdraft', 'overdraft transaction', 'settle transaction overdraft', 'overdraft transaction exceed', 'debit card purchase', 'transaction exceed balance', 'pay settle transaction', 'debit card', 'settle transaction']"
14,5,nightly processing. If your account has a negative balance it is considered to be overdrawn. PIN:  A four-digit personal identi ﬁcation number that you either select or request from us for your debit or ATM card. Some merchants and all ATMs require a PIN ,nightly processing . account negative balance considered overdrawn . PIN : four-digit personal identi ﬁcation number either select request u debit ATM card . merchant ATMs require PIN,"['request debit atm', 'debit atm card', 'debit atm', 'atms require pin', 'atms require', 'atm card', 'merchant atms require', 'processing account negative', 'atm card merchant', 'merchant atms']"
15,5,"when you use a debit card.Present balance:  The total amount of money recorded in your account, including funds not yet available for you to use. This includes pending transactions, ","use debit card.Present balance : total amount money recorded account , including fund yet available use . includes pending transaction ,","['present balance', 'present balance total', 'card present balance', 'balance total money', 'debit card present', 'use debit', 'balance total', 'debit card', 'money recorded account', 'account including fund']"
16,5,"authorization holds that are not yet posted or deposits that have not yet been made available. You can ﬁnd this balance on receipts you receive at ATMs, from a ","authorization hold yet posted deposit yet made available . ﬁnd balance receipt receive ATMs ,","['posted deposit available', 'authorization hold posted', 'receipt receive atms', 'authorization hold', 'deposit available', 'deposit available ﬁnd', 'receive atms', 'hold posted deposit', 'posted deposit', 'balance receipt receive']"
17,5,"banker at a branch, on chase.com or Chase Mobile. II. Opening Your Account","banker branch , chase.com Chase Mobile . II . Opening Account","['branch chase com', 'banker branch chase', 'com chase mobile', 'chase mobile', 'chase com', 'branch chase', 'chase com chase', 'chase mobile ii', 'banker branch', 'opening account']"
18,5,A. Personal Accounts,. Personal Accounts,"['personal accounts', 'accounts', 'personal']"
19,5,"THE TYPE OF ACCOUNT OWNERSHIP MAY DETERMINE HOW YOUR FUNDS ARE PAID IF YOU DIE, EVEN IF YOUR WILL STATES OTHERWISE. PLEASE CONSULT YOUR ESTATE PLANNING ADVISOR OR ATTORNEY ABOUT YOUR CHOICES. If your account is a type listed under “Personal Accounts” in our product information, you agree not to use it for business purposes. Ownership of your account is ","TYPE ACCOUNT OWNERSHIP MAY DETERMINE FUNDS PAID DIE , EVEN STATES OTHERWISE . PLEASE CONSULT ESTATE PLANNING ADVISOR ATTORNEY CHOICES . account type listed “ Personal Accounts ” product information , agree use business purpose . Ownership account","['ownership determine funds', 'type account ownership', 'account ownership determine', 'funds paid die', 'ownership account', 'consult estate', 'states consult estate', 'account ownership', 'consult estate planning', 'purpose ownership account']"
20,5,"determined by the most current signature card. However, we are authorized to rely on the account ownership information contained in our deposit system unless we ","determined current signature card . However , authorized rely account ownership information contained deposit system unless","['signature card authorized', 'current signature card', 'card authorized rely', 'information contained deposit', 'account ownership information', 'authorized rely account', 'rely account ownership', 'current signature', 'signature card', 'contained deposit']"
21,5,"are noti ﬁed that the most current signature card and the deposit system contain different information. 1. Solely owned accountWhen only one individual is listed as the owner of an account, we will treat the account as a solely owned account. 2. Joint accounts","noti ﬁed current signature card deposit system contain different information . 1 . Solely owned accountWhen one individual listed owner account , treat account solely owned account . 2 . Joint account","['signature card deposit', 'card deposit contain', 'current signature card', 'signature card', 'card deposit', 'account joint account', 'current signature', 'joint account', 'account joint', 'account treat account']"
22,5,"When two or more people are listed as owners of a personal account, the account is a “joint account” and each owner is a “joint owner.”","two people listed owner personal account , account “ joint account ” owner “ joint owner . ”","['joint account owner', 'account owner joint', 'owner personal account', 'joint owner', 'account joint account', 'owner joint owner', 'people listed owner', 'account account joint', 'account joint', 'account owner']"
23,5,Each joint owner has complete control over all of the funds in the account. Return to Table of Contents,joint owner complete control fund account . Return Table Contents,"['account return table', 'joint owner complete', 'complete control fund', 'joint owner', 'control fund account', 'control fund', 'fund account return', 'owner complete control', 'return table', 'return table contents']"
24,6,"Effective 10/15/2023If your joint account becomes overdrawn, each joint owner is liable for the full amount the account is overdrawn, regardless of who initiated or bene ﬁted from the ","Effective 10/15/2023If joint account becomes overdrawn , joint owner liable full amount account overdrawn , regardless initiated bene ﬁted","['joint account overdrawn', '2023if joint account', 'liable account overdrawn', 'joint account', 'account overdrawn joint', 'liable account', 'overdrawn joint owner', 'joint owner liable', 'owner liable account', 'account overdrawn regardless']"
25,6,"activity that caused the overdraft. If one joint owner requests that we not pay transactions initiated by a different joint owner, we may block the account, but we are not required to do so. That means we ","activity caused overdraft . one joint owner request pay transaction initiated different joint owner , may block account , required . mean","['overdraft joint owner', 'activity caused overdraft', 'caused overdraft', 'overdraft joint', 'caused overdraft joint', 'joint owner block', 'joint owner request', 'overdraft', 'joint owner', 'different joint owner']"
26,6,"will refuse to pay all transactions, including transactions initiated by the owner making the request. If we block the account, we may not release the block unless all joint owners agree in writing to remove it. No request to block the account will affect transactions that we paid before the request. If we decide not to block the account, all joint owners remain responsible for transactions subtracted from the account. Any joint owner may close the account without the consent from any other joint owners. We may choose whether or not to act upon other instructions of any joint ","refuse pay transaction , including transaction initiated owner making request . block account , may release block unless joint owner agree writing remove . request block account affect transaction paid request . decide block account , joint owner remain responsible transaction subtracted account . joint owner may close account without consent joint owner . may choose whether act upon instruction joint","['block account joint', 'refuse pay transaction', 'responsible transaction subtracted', 'account consent joint', 'consent joint owner', 'joint owner agree', 'remain responsible transaction', 'account joint owner', 'responsible transaction', 'joint owner choose']"
27,6,"owners, including adding another owner to the account, without the authorization of the other joint owners. We may also pay all or any part of the funds in the joint ","owner , including adding another owner account , without authorization joint owner . may also pay part fund joint","['joint owner', 'authorization joint owner', 'joint owner pay', 'pay fund joint', 'account authorization joint', 'owner including adding', 'fund joint', 'owner account', 'owner pay fund', 'adding owner account']"
28,6,"account to a court or government agency if we receive a garnishment, levy or similar legal process that identi ﬁes any of the joint owners.   Joint account with rights of survivorship  ","account court government agency receive garnishment , levy similar legal process identi ﬁes joint owner . Joint account right survivorship","['agency receive garnishment', 'garnishment levy', 'receive garnishment', 'receive garnishment levy', 'garnishment levy similar', 'garnishment', 'account court government', 'account court', 'owner joint account', 'account right survivorship']"
29,6,"If a joint account has rights of survivorship, and one joint owner dies, the account ownership will be transferred to the surviving joint owners. The estate of the deceased owner will have no rights to the account. If there is more than one surviving joint owner, the account will continue as a joint account with rights of survivorship among the remaining owners. If an account is designated “JAWROS” or “JTWROS,” it has rights of survivorship.   Joint account with no right of survivorship (also called “tenants in common”)  ","joint account right survivorship , one joint owner dy , account ownership transferred surviving joint owner . estate deceased owner right account . one surviving joint owner , account continue joint account right survivorship among remaining owner . account designated “ JAWROS ” “ JTWROS , ” right survivorship . Joint account right survivorship ( also called “ tenant common ” )","['survivorship joint account', 'joint owner account', 'joint account right', 'account surviving joint', 'survivorship joint owner', 'account right survivorship', 'joint owner estate', 'surviving joint owner', 'right survivorship joint', 'joint account']"
30,6,"If a joint account does not have rights of survivorship, and one joint owner dies, that owner’s interest passes to the owner’s estate. Either the surviving joint owners or the deceased owner’s estate may withdraw the funds at any time, and we have no responsibility for determining the respective interests of the owners. If an account is designated “Tenants in common” or “JTIC,” it does not have rights of survivorship.   When survivorship rights apply  ","joint account right survivorship , one joint owner dy , owner ’ interest pass owner ’ estate . Either surviving joint owner deceased owner ’ estate may withdraw fund time , responsibility determining respective interest owner . account designated “ Tenants common ” “ JTIC , ” right survivorship . survivorship right apply","['joint account right', 'survivorship joint owner', 'joint account', 'account right survivorship', 'surviving joint owner', 'respective owner account', 'joint owner dy', 'joint owner', 'account designated tenants', 'survivorship joint']"
31,6,"Except as otherwise stated in this paragraph, a joint account has rights of survivorship unless you clearly indicate on the signature card and in the account title that the account is created without these rights. Accounts in Louisiana do not have rights of survivorship. Accounts in Texas do not have rights of survivorship unless you clearly indicate on the signature card and in the account title that the account is created with these rights.   If a joint account also contains a “payable on death” or “in trust for” designation, the account always includes a right of survivorship and is payable to the ","Except otherwise stated paragraph , joint account right survivorship unless clearly indicate signature card account title account created without right . Accounts Louisiana right survivorship . Accounts Texas right survivorship unless clearly indicate signature card account title account created right . joint account also contains “ payable death ” “ trust ” designation , account always includes right survivorship payable","['joint account right', 'account right survivorship', 'survivorship accounts texas', 'right joint account', 'right survivorship accounts', 'survivorship accounts', 'texas right survivorship', 'joint account contains', 'louisiana right survivorship', 'right survivorship payable']"
32,6,"bene ﬁciary only upon the death of the last surviving owner, except as stated in the paragraph below.   Marital account (Wisconsin only)  ","bene ﬁciary upon death last surviving owner , except stated paragraph . Marital account ( Wisconsin )","['marital account wisconsin', 'death surviving owner', 'surviving owner stated', 'paragraph marital account', 'marital account', 'surviving owner', 'bene ﬁciary death', 'owner stated paragraph', 'stated paragraph marital', 'paragraph marital']"
33,6,"If one owner of a marital account dies, the survivor is entitled to 50% of the account funds and the estate of the deceased is entitled to the other 50%. If a marital ","one owner marital account dy , survivor entitled 50 % account fund estate deceased entitled 50 % . marital","['owner marital account', 'account fund estate', 'marital account', 'marital account dy', 'estate deceased entitled', 'fund estate deceased', 'owner marital', 'fund estate', 'entitled 50 marital', 'deceased entitled 50']"
34,6,"account contains a payable on death designation, the POD bene ﬁciary is entitled to the deceased spouse’s 50% share. However, we have no responsibility to ","account contains payable death designation , POD bene ﬁciary entitled deceased spouse ’ 50 % share . However , responsibility","['entitled deceased spouse', 'ﬁciary entitled deceased', 'payable death designation', 'contains payable death', '50 share responsibility', 'payable death', 'spouse 50 share', 'deceased spouse 50', 'bene ﬁciary entitled', 'deceased spouse']"
35,6,determine the respective interests of the owner and the POD bene ﬁciary.   Tenants by the entirety (Florida only)  ,determine respective interest owner POD bene ﬁciary . Tenants entirety ( Florida ),"['tenants entirety florida', 'ﬁciary tenants entirety', 'tenants entirety', 'determine respective owner', 'ﬁciary tenants', 'respective owner', 'respective owner pod', 'bene ﬁciary tenants', 'tenants', 'entirety florida']"
36,6,A Florida joint account owned solely by two spouses is a “tenants by the entirety” account unless the signature card indicates otherwise. We are not required to determine whether an account is a tenants by the entirety account before responding to a garnishment or other legal process. We may assert our right of setoff or security interest in a tenants by the entirety account in order to collect debts of either owner. 3. “Payable on death” account,Florida joint account owned solely two spouse “ tenant entirety ” account unless signature card indicates otherwise . required determine whether account tenant entirety account responding garnishment legal process . may assert right setoff security interest tenant entirety account order collect debt either owner . 3 . “ Payable death ” account,"['florida joint account', 'joint account owned', 'spouse tenant entirety', 'account responding garnishment', 'joint account', 'account tenant entirety', 'responding garnishment legal', 'garnishment legal process', 'responding garnishment', 'garnishment legal']"
