,Page,Formatted_content,Processed_content,keywords
357,21," t permit withdrawals if funds have not been credited to the account. • The amount of your penalty will be deducted from principal. For Business CDs: • If the term of the CD is less than 12 months, the early withdrawal penalty is equal to $25 plus 1% of the amount withdrawn. • For terms of 12 months or more, the early withdrawal penalty is equal to $25 plus 3% of the amount withdrawn. • If the withdrawal occurs less than seven days after opening the CD or making another withdrawal of principal, the early withdrawal penalty will be calculated as described above, but it cannot be less than seven days’ interest. W e may no","permit withdrawal fund credited account . • amount penalty deducted principal . Business CDs : • term CD le 12 month , early withdrawal penalty equal $ 25 plus 1 % amount withdrawn . • term 12 month , early withdrawal penalty equal $ 25 plus 3 % amount withdrawn . • withdrawal occurs le seven day opening CD making another withdrawal principal , early withdrawal penalty calculated described , le seven day ’ interest . W e may","['permit withdrawal fund', 'withdrawal penalty', 'early withdrawal penalty', 'cd making withdrawal', 'withdrawal penalty calculated', 'withdrawal penalty equal', 'permit withdrawal', 'withdrawal principal', 'account penalty', 'withdrawal principal early']"
358,21," t permit withdrawals if funds have not been credited to the account. • The amount of your penalty will be deducted from principal. Waiving early withdrawal penalties for Personal CDs:We will waive early withdrawal penalties under the circumstances described below, unless these withdrawals occur less than seven days after the account was opened or a previous withdrawal was made. For non-retirement CDs: • Death of a CD owner or a grantor of a revocable family/living trust;","permit withdrawal fund credited account . • amount penalty deducted principal . Waiving early withdrawal penalty Personal CDs : waive early withdrawal penalty circumstance described , unless withdrawal occur le seven day account opened previous withdrawal made . non-retirement CDs : • Death CD owner grantor revocable family/living trust ;","['penalty personal cds', 'permit withdrawal fund', 'personal cds waive', 'withdrawal penalty circumstance', 'early withdrawal penalty', 'cds waive early', 'cds waive', 'permit withdrawal', 'withdrawal penalty personal', 'withdrawal penalty']"
359,21,• Disability of a CD owner;,• Disability CD owner ;,"['disability cd owner', 'disability cd', 'cd owner', 'disability', 'cd', 'owner']"
360,21,• A court’s determination that a CD owner is incompetent; and,• court ’ determination CD owner incompetent ;,"['cd owner incompetent', 'court determination cd', 'determination cd owner', 'cd owner', 'court determination', 'owner incompetent', 'determination cd', 'court', 'cd', 'incompetent']"
361,21,"• Re-titling of a CD to transfer ownership of funds into a living trust without moving funds from the bank and where no change in term or rate occurs. For retirement CDs: • If the retirement CD owner is withdrawing an excess annual retirement contribution amount and any corresponding earnings. We will also waive early withdrawal penalties for retirement CDs under the circumstances described below, regardless of when the early withdrawal is made in relation to the CD opening or a previous withdrawal. • Death or disability of a retirement CD owner;","• Re-titling CD transfer ownership fund living trust without moving fund bank change term rate occurs . retirement CDs : • retirement CD owner withdrawing excess annual retirement contribution amount corresponding earnings . also waive early withdrawal penalty retirement CDs circumstance described , regardless early withdrawal made relation CD opening previous withdrawal . • Death disability retirement CD owner ;","['retirement cds circumstance', 'retirement cd owner', 'occurs retirement cds', 'cds retirement cd', 'cds retirement', 'retirement cds retirement', 'disability retirement cd', 'cd owner withdrawing', 'penalty retirement cds', 'retirement cd']"
362,21,• A court’s determination that a retirement CD owner is incompetent; and,• court ’ determination retirement CD owner incompetent ;,"['court determination retirement', 'determination retirement cd', 'cd owner incompetent', 'retirement cd owner', 'court determination', 'retirement cd', 'owner incompetent', 'cd owner', 'court', 'determination retirement']"
363,21,"• If the retirement CD owner is age 59½ or older and the funds are taken as an IRS-reportable distribution via cash, check, or deposit or transfer to a non-","• retirement CD owner age 59½ older fund taken IRS-reportable distribution via cash , check , deposit transfer non-","['retirement cd owner', 'reportable distribution cash', 'distribution cash check', 'distribution cash', 'retirement cd', 'irs reportable distribution', 'fund taken irs', 'older fund taken', 'deposit transfer non', 'check deposit transfer']"
364,21,"retirement account. This waiver does not apply if the transfer is to a retirement account at another ﬁnancial institution. Waiving early withdrawal penalties for Business CDs owned by a sole proprietorship:We will waive early withdrawal penalties under the circumstances described below, unless these withdrawals occur less than seven days after the account was opened or a previous withdrawal was made. • Death of a CD owner or a grantor of a revocable family/living trust;","retirement account . waiver apply transfer retirement account another ﬁnancial institution . Waiving early withdrawal penalty Business CDs owned sole proprietorship : waive early withdrawal penalty circumstance described , unless withdrawal occur le seven day account opened previous withdrawal made . • Death CD owner grantor revocable family/living trust ;","['retirement account waiver', 'waiving early withdrawal', 'transfer retirement', 'waive early withdrawal', 'penalty business cds', 'early withdrawal penalty', 'apply transfer retirement', 'withdrawal penalty business', 'transfer retirement account', 'institution waiving early']"
365,21,• Disability of a CD owner;,• Disability CD owner ;,"['disability cd owner', 'disability cd', 'cd owner', 'disability', 'cd', 'owner']"
366,21,• A court’s determination that a CD owner is incompetent; and,• court ’ determination CD owner incompetent ;,"['cd owner incompetent', 'court determination cd', 'determination cd owner', 'cd owner', 'court determination', 'owner incompetent', 'determination cd', 'court', 'cd', 'incompetent']"
367,21,• Re-titling of a CD to transfer ownership of funds into a living trust without moving funds from the bank and where no change in term or rate occurs. VIII. Closing Your Account,• Re-titling CD transfer ownership fund living trust without moving fund bank change term rate occurs . VIII . Closing Account,"['transfer ownership fund', 'trust moving fund', 'bank change term', 'fund bank change', 'living trust moving', 'moving fund', 'titling cd transfer', 'cd transfer ownership', 'moving fund bank', 'viii closing account']"
368,21,"Either you or we may close your account (other than a CD) at any time for any reason or no reason without prior notice. We are not required to close your account at your request if you have pending transactions, the account is overdrawn, your account is subject to legal process (such as a garnishment, attachment, execution or levy) or any type of holds (such as collateral hold, decedent hold or deposit hold). In those cases, we will limit the types of transactions that you can make until pending transactions are paid or returned, the balance is no longer negative and any legal restriction/hold has been released. After we restrict your account in preparation for closing, we will not pay any additional interest on the account. We may automatically close your account if the balance is $0 or negative. Either you or we may close your CD account on any maturity date without cause. We may send you written notice that we have closed or will close your account and return the balance less any fees, claims, setoffs or other amounts if the balance is ","Either may close account ( CD ) time reason reason without prior notice . required close account request pending transaction , account overdrawn , account subject legal process ( garnishment , attachment , execution levy ) type hold ( collateral hold , decedent hold deposit hold ) . case , limit type transaction make pending transaction paid returned , balance longer negative legal restriction/hold released . restrict account preparation closing , pay additional interest account . may automatically close account balance $ 0 negative . Either may close CD account maturity date without cause . may send written notice closed close account return balance le fee , claim , setoff amount balance","['close account balance', 'account preparation closing', 'closed close account', 'close cd account', 'close account cd', 'required close account', 'cd account maturity', 'close account return', 'automatically close account', 'close account']"
369,21,"greater than $1. After your account is closed, we have no obligation to accept deposits or pay any outstanding checks, but we may reopen your account if we receive a deposit. We will have no liability for refusing to honor any check drawn on a closed account. We may advise consumer reporting agencies of accounts closed for misuse, such as overdrafts. This agreement continues to apply to your account and issues related to your account even after it closes. Return to Table of Contents","greater $ 1 . account closed , obligation accept deposit pay outstanding check , may reopen account receive deposit . liability refusing honor check drawn closed account . may advise consumer reporting agency account closed misuse , overdraft . agreement continues apply account issue related account even close . Return Table Contents","['account closed obligation', 'closed misuse overdraft', 'account advise consumer', 'closed obligation', 'greater account closed', 'overdraft agreement', 'obligation accept deposit', 'deposit liability', 'drawn closed account', 'closed account advise']"
370,22,Effective 10/15/2023IX. Other Legal Terms,Effective 10/15/2023IX . Legal Terms,"['2023ix legal terms', '2023ix legal', '15 2023ix legal', 'effective 10 15', 'legal terms', '2023ix', 'effective 10', 'legal', '15 2023ix', '10 15 2023ix']"
371,22,A. Rules Governing Your Account,. Rules Governing Account,"['rules governing account', 'governing account', 'account', 'rules governing', 'rules', 'governing']"
372,22,"This agreement, all accounts and services provided to you, and any dispute relating to those accounts and services are governed by federal law and, when not superseded by federal law, the law of the state where your account is located. Here’s how we determine where your account is located: • If you applied for the account in person at one of our banking offices, then the account is located in the state where you applied. • If you applied in person for a business account with one of our representatives somewhere other than at one of our banking offices (your place of business, for ","agreement , account service provided , dispute relating account service governed federal law , superseded federal law , law state account located . ’ determine account located : • applied account person one banking office , account located state applied . • applied person business account one representative somewhere one banking office ( place business ,","['law state account', 'dispute relating account', 'account service governed', 'provided dispute relating', 'agreement account service', 'account representative banking', 'relating account service', 'representative banking office', 'state account located', 'account located state']"
373,22,"example), your account is located in the state where the representative’s business office is located. • If you applied for the account by mail, digitally, or through other remote means, and your address as recorded in our records was in a state where we had a ","example ) , account located state representative ’ business office located . • applied account mail , digitally , remote mean , address recorded record state","['account located state', 'office located applied', 'address recorded record', 'located state representative', 'located state', 'address recorded', 'representative business office', 'mean address recorded', 'office located', 'mean address']"
374,22,"branch at the time, then the account is located in that state, which for joint accounts will be based on the address of the owner whose name was listed ﬁrst. • In all other cases your account will be governed by Ohio law. Business trust accounts for professionals regulated by a state (or a self-regulatory body under a state’s laws) are located in the designated state. B. General Liability","branch time , account located state , joint account based address owner whose name listed ﬁrst . • case account governed Ohio law . Business trust account professional regulated state ( self-regulatory body state ’ law ) located designated state . B . General Liability","['account governed ohio', 'ohio law business', 'case account governed', 'governed ohio law', 'law business trust', 'account governed', 'state joint account', 'account professional regulated', 'business trust account', 'state general liability']"
375,22,"Any provision of this agreement that limits the bank’s liability does not negate the bank’s duty (if any) under applicable law to act in good faith and with reasonable care. If any provision of this agreement is determined to limit the bank’s liability in a way prohibited by applicable law, the provision will nevertheless be enforced to the fullest extent permitted under that law. We will not be liable for anything we do when following your instructions. In addition, we will not be liable if we do not follow your instructions if we reasonably believe ","provision agreement limit bank ’ liability negate bank ’ duty ( ) applicable law act good faith reasonable care . provision agreement determined limit bank ’ liability way prohibited applicable law , provision nevertheless enforced fullest extent permitted law . liable anything following instruction . addition , liable follow instruction reasonably believe","['liability negate bank', 'bank liability negate', 'permitted law liable', 'bank liability', 'limit bank liability', 'law liable', 'law liable following', 'bank liability way', 'applicable law provision', 'liable following']"
376,22,"that your instructions would expose us to potential loss or civil or criminal liability, or con flict with customary banking practices. WE WILL NOT BE LIABLE FOR ","instruction would expose u potential loss civil criminal liability , con flict customary banking practice . LIABLE","['banking practice liable', 'banking practice', 'liability flict customary', 'customary banking practice', 'practice liable', 'liability flict', 'customary banking', 'banking', 'potential loss civil', 'criminal liability']"
377,22,"INDIRECT, SPECIAL, OR CONSEQUENTIAL DAMAGES REGARDLESS OF THE FORM OF ACTION AND EVEN IF WE HAVE BEEN ADVISED OF THE ","INDIRECT , SPECIAL , CONSEQUENTIAL DAMAGES REGARDLESS FORM ACTION EVEN ADVISED","['special consequential damages', 'consequential damages regardless', 'consequential damages', 'damages regardless form', 'damages regardless', 'damages', 'indirect special consequential', 'consequential', 'special consequential', 'indirect special']"
378,22,"POSSIBILITY OF SUCH DAMAGES. IF WE FAIL TO STOP PAYMENT ON AN ITEM, OR PAY AN ITEM BEARING AN UNAUTHORIZED SIGNATURE, FORGED SIGNATURE, OR FORGED ENDORSEMENT OR ALTERATION, OUR LIABILITY, IF ANY, WILL BE LIMITED TO THE FACE AMOUNT OF THE ITEM. If this agreement con flicts with any statements made by one of our employees or by our afﬁliates’ employees, this agreement will govern. C. Restricting Your Account; Blocking or Delaying TransactionsThere are many reasons we may decline or prevent transactions to or from your account or otherwise restrict your account, but we generally do it to protect you or us, or to comply with legal requirements or Legal Process. You acknowledge and agree that we may decline or prevent any or all transactions to or from your account, including refusing, freezing, reversing or delaying any speciﬁc withdrawal, payment or transfer of funds to or from your account, or removing funds from your account to hold them pending investigation, including in one or more of the following circumstances: • Your account is involved in any legal or administrative proceeding;","POSSIBILITY DAMAGES . FAIL STOP PAYMENT ITEM , PAY ITEM BEARING UNAUTHORIZED SIGNATURE , FORGED SIGNATURE , FORGED ENDORSEMENT ALTERATION , LIABILITY , , LIMITED FACE AMOUNT ITEM . agreement con flicts statement made one employee afﬁliates ’ employee , agreement govern . C. Restricting Account ; Blocking Delaying TransactionsThere many reason may decline prevent transaction account otherwise restrict account , generally protect u , comply legal requirement Legal Process . acknowledge agree may decline prevent transaction account , including refusing , freezing , reversing delaying speciﬁc withdrawal , payment transfer fund account , removing fund account hold pending investigation , including one following circumstance : • account involved legal administrative proceeding ;","['fail stop payment', 'prevent transaction account', 'bearing unauthorized signature', 'prevent transaction', 'forged signature', 'account involved legal', 'decline prevent transaction', 'forged signature forged', 'stop payment', 'transaction account restrict']"
379,22,"• We receive conflicting information or instructions regarding account ownership, c ontrol, funds or activity;","• receive conflicting information instruction regarding account ownership , c ontrol , fund activity ;","['instruction regarding account', 'ownership ontrol fund', 'conflicting information instruction', 'regarding account ownership', 'regarding account', 'account ownership ontrol', 'account ownership', 'receive conflicting information', 'ontrol fund activity', 'instruction regarding']"
380,22,"• We suspect that you may be the victim of a fraud, scam or ﬁnancial exploitation, even though you have authorized the transaction(s);","• suspect may victim fraud , scam ﬁnancial exploitation , even though authorized transaction ( ) ;","['suspect victim fraud', 'victim fraud', 'victim fraud scam', 'exploitation authorized transaction', 'scam ﬁnancial exploitation', 'fraud scam ﬁnancial', 'authorized transaction', 'suspect victim', 'fraud', 'fraud scam']"
381,22,• We suspect that any transaction may involve illegal activity or may be fraudulent;,• suspect transaction may involve illegal activity may fraudulent ;,"['suspect transaction involve', 'suspect transaction', 'illegal activity fraudulent', 'activity fraudulent', 'transaction involve illegal', 'illegal activity', 'fraudulent', 'involve illegal activity', 'transaction involve', 'involve illegal']"
382,22,"• We are complying in our sole discretion with any federal, state or local law, rule or regulation, including federal asset control and sanction rules and anti-money-laundering rules, or with our policies adopted to ensure that we comply with those laws, rules or regulations; or","• complying sole discretion federal , state local law , rule regulation , including federal asset control sanction rule anti-money-laundering rule , policy adopted ensure comply law , rule regulation ;","['ensure comply law', 'anti money laundering', 'money laundering rule', 'regulation including', 'regulation including federal', 'laundering rule policy', 'law rule regulation', 'rule regulation including', 'comply law rule', 'comply law']"
383,22,"• We reasonably believe that doing so is necessary to avoid a loss or reduce risk to us. We also may limit cash deposits to, or withdrawals from, your account (or all of your accounts collectively) in a single transaction or total withdrawals or deposits during any period of time, or who may make deposits, in order to reduce risk and/or enhance our efforts to comply with applicable law. We may assign and transfer your account information and documentation to a replacement account number at our discretion and without notice to you. We may make ","• reasonably believe necessary avoid loss reduce risk u . also may limit cash deposit , withdrawal , account ( account collectively ) single transaction total withdrawal deposit period time , may make deposit , order reduce risk and/or enhance effort comply applicable law . may assign transfer account information documentation replacement account number discretion without notice . may make","['deposit withdrawal account', 'assign transfer account', 'limit cash deposit', 'withdrawal account account', 'account number discretion', 'withdrawal account', 'make deposit', 'cash deposit withdrawal', 'cash deposit', 'withdrawal deposit']"
384,22,"this assignment when we deem necessary to avoid disruptions, including when your account is reported compromised by you or any signer. If we issue you a replacement account number, this agreement governing you and your account will continue to apply, without interruption, as if you retained the discontinued account number. We will have no liability for any action we take under this section and/or related sections, and we may take such action without advance notice. To the extent that any ","assignment deem necessary avoid disruption , including account reported compromised signer . issue replacement account number , agreement governing account continue apply , without interruption , retained discontinued account number . liability action take section and/or related section , may take action without advance notice . extent","['reported compromised signer', 'agreement governing account', 'account number liability', 'account number agreement', 'disruption including account', 'compromised signer', 'liability action section', 'compromised signer issue', 'governing account continue', 'liability action']"
385,22,"action we take is related to Legal Process or an Adverse Claim, please refer to those sections for additional information. D. Changes to the Agreement","action take related Legal Process Adverse Claim , please refer section additional information . D. Changes Agreement","['changes agreement', 'process adverse claim', 'adverse claim refer', 'adverse claim', 'information changes agreement', 'legal process adverse', 'action related legal', 'related legal process', 'claim refer section', 'process adverse']"
386,22,"We may change the terms of this agreement, including fees and features of your account, at any time. If any change would adversely affect you, we will notify you in advance, unless the change is necessary to comply with a legal requirement. For CDs, changes that would adversely affect you will be effective on the next maturity date.If we transfer your account to a different business unit within the bank, we may give notice in the same manner and provide you a different deposit agreement to ","may change term agreement , including fee feature account , time . change would adversely affect , notify advance , unless change necessary comply legal requirement . CDs , change would adversely affect effective next maturity date.If transfer account different business unit within bank , may give notice manner provide different deposit agreement","['change term agreement', 'different deposit agreement', 'term agreement', 'provide different deposit', 'term agreement including', 'different deposit', 'deposit agreement', 'bank notice manner', 'transfer account different', 'maturity date transfer']"
387,22,govern your account. You agree that notice of these changes may be provided to any joint owner. We are not required to send you notice of interest rate and Annual Percentage Yield changes for variable rate accounts or notice of changes in printing fees for ,govern account . agree notice change may provided joint owner . required send notice interest rate Annual Percentage Yield change variable rate account notice change printing fee,"['rate account notice', 'account agree notice', 'govern account', 'account notice change', 'account notice', 'variable rate account', 'govern account agree', 'agree notice change', 'notice rate', 'notice change provided']"
388,22,documents (such as checks). We may direct you to a branch or chase.com for the content of any changes or the revised agreement unless the law requires a different method. By maintaining your ,document ( check ) . may direct branch chase.com content change revised agreement unless law requires different method . maintaining,"['change revised agreement', 'revised agreement', 'branch chase com', 'direct branch chase', 'branch chase', 'revised agreement unless', 'chase com content', 'chase com', 'change revised', 'chase']"
389,22,"account after the effective date of any change, you agree to the change. This agreement takes the place of any understandings, agreements, representations, and warranties, both written and oral, made prior to or when you entered into this ","account effective date change , agree change . agreement take place understanding , agreement , representation , warranty , written oral , made prior entered","['agree change agreement', 'change agreement', 'date change agree', 'effective date change', 'account effective date', 'change agreement place', 'agreement representation warranty', 'date change', 'agreement representation', 'place understanding agreement']"
